{
  "schema_id": "pytex.validation_manifest",
  "schema_version": "1.0.0",
  "pytex_version": "0.1.0.dev0",
  "created_at": "2026-03-30T00:00:00Z",
  "campaign_name": "labotex_open_pole_figure_validation",
  "subsystem": "texture",
  "baseline_kind": "public_external_open_data",
  "status": "implemented",
  "reference_ids": [
    "LaboTex_formats_page",
    "LaboTex_exercises_archive"
  ],
  "fixture_ids": [],
  "artifact_paths": [
    "docs/testing/mtex_parity_matrix.md",
    "docs/site/workflows/labotex_open_pole_figures.md",
    "benchmarks/texture/labotex_open_pole_figure_benchmark_manifest.json",
    "src/pytex/adapters/labotex.py",
    "tests/unit/test_labotex_texture.py",
    "scripts/run_open_labotex_validation.py"
  ],
  "linked_benchmark_ids": [
    "texture_labotex_open_pole_figure_validation"
  ],
  "notes": [
    "This validation campaign covers LaboTex PPF and EPF import semantics and the external open-data validation path for Cu, Fe, and Al measured pole figures.",
    "Because redistribution terms are not explicit on the source site, the public exercise datasets are acquired on demand into ignored inspection outputs rather than vendored into the repository."
  ]
}
