{
  "schema_id": "pytex.validation_manifest",
  "schema_version": "1.0.0",
  "pytex_version": "0.1.0.dev0",
  "created_at": "2026-03-26T00:00:00Z",
  "campaign_name": "structure_import_foundation_validation",
  "subsystem": "structure_import",
  "baseline_kind": "cif_and_space_group_semantics",
  "status": "foundational",
  "reference_ids": [
    "IUCr_A",
    "IUCr_G",
    "De_Graef_McHenry"
  ],
  "fixture_ids": [
    "fe_bcc",
    "zr_hcp",
    "ni_fcc",
    "nicl",
    "diamond"
  ],
  "artifact_paths": [
    "docs/testing/structure_validation_matrix.md",
    "benchmarks/structure_import/foundation_benchmark_manifest.json",
    "benchmarks/structure_import/foundation_workflow_result_manifest.json",
    "benchmarks/structure_import/phase_fixture_audit_summary.json",
    "fixtures/phases/catalog.json",
    "fixtures/phases/fe_bcc/metadata.json",
    "fixtures/phases/zr_hcp/metadata.json",
    "fixtures/phases/ni_fcc/metadata.json",
    "fixtures/phases/nicl/metadata.json",
    "fixtures/phases/diamond/metadata.json"
  ],
  "linked_benchmark_ids": [
    "structure_import_foundation_internal_baseline"
  ],
  "notes": [
    "Parser-success tests are not the whole story; this validation campaign tracks the broader structure-import evidence base.",
    "Bundled phase-fixture metadata provide the pinned provenance and expected crystallographic semantics for this campaign.",
    "The current structure-import validation surface requires catalog-level integrity checks and fixture-level semantic expectations, not only parser success.",
    "The pinned structure-import audit summary records conventional and primitive semantics for every bundled fixture."
  ]
}
