{
  "schema_id": "pytex.validation_manifest",
  "schema_version": "1.0.0",
  "pytex_version": "0.1.0.dev0",
  "created_at": "2026-03-31T00:00:00Z",
  "campaign_name": "phase_transformation_foundation_validation",
  "subsystem": "transformation",
  "baseline_kind": "internal_semantics_plus_literature_tracked_foundation",
  "status": "foundational",
  "reference_ids": [
    "Porter_Easterling_Sherif_Phase_Transformations",
    "PyTex_Transformation_Foundation"
  ],
  "fixture_ids": [
    "tests/unit/test_transformation.py",
    "tests/unit/test_experimental_phase_transformation.py"
  ],
  "artifact_paths": [
    "docs/testing/phase_transformation_validation_matrix.md",
    "docs/architecture/phase_transformation_foundation.md",
    "benchmarks/transformation/variant_prediction_benchmark_manifest.json",
    "src/pytex/core/transformation.py",
    "src/pytex/experimental/phase_transformation.py",
    "tests/unit/test_transformation.py",
    "tests/unit/test_experimental_phase_transformation.py"
  ],
  "linked_benchmark_ids": [
    "phase_transformation_variant_prediction"
  ],
  "notes": [
    "PyTex now validates transformation semantics, variant-indexed prediction, and bounded experimental parent scoring in-repo.",
    "The campaign remains foundational because broad literature-backed transformation families and curated reconstruction datasets are still ahead."
  ]
}
