{
  "schema_id": "pytex.validation_manifest",
  "schema_version": "1.0.0",
  "pytex_version": "0.1.0.dev0",
  "created_at": "2026-04-29T00:00:00Z",
  "campaign_name": "diffraction_foundation_validation",
  "subsystem": "diffraction",
  "baseline_kind": "internal_plus_literature_growth",
  "status": "foundational",
  "reference_ids": [
    "IUCr_C",
    "Fultz_Howe_TEM"
  ],
  "fixture_ids": [
    "fe_bcc",
    "zr_hcp",
    "ni_fcc",
    "nicl",
    "diamond"
  ],
  "artifact_paths": [
    "docs/testing/diffraction_validation_matrix.md",
    "benchmarks/diffraction/external_baseline_benchmark_manifest.json",
    "benchmarks/diffraction/external_baseline_workflow_result_manifest.json",
    "fixtures/diffraction/README.md",
    "fixtures/diffraction/ni_fcc_pymatgen_xrd_cuka.json",
    "fixtures/diffraction/ni_fcc_diffsims_saed_001_200kev.json",
    "fixtures/diffraction/fe_bcc_pymatgen_xrd_cuka.json",
    "fixtures/diffraction/fe_bcc_diffsims_saed_001_200kev.json",
    "fixtures/diffraction/zr_hcp_pymatgen_xrd_cuka.json",
    "fixtures/phases/catalog.json",
    "fixtures/phases/fe_bcc/metadata.json",
    "fixtures/phases/zr_hcp/metadata.json",
    "fixtures/phases/ni_fcc/metadata.json",
    "fixtures/phases/nicl/metadata.json",
    "fixtures/phases/diamond/metadata.json"
  ],
  "linked_benchmark_ids": [
    "diffraction_foundation_internal_baseline",
    "diffraction_external_baseline_cases"
  ],
  "notes": [
    "Internal invariants are implemented and pinned external-baseline cases now cover cubic powder XRD and SAED for ni_fcc and fe_bcc plus non-cubic powder XRD for zr_hcp.",
    "Powder reflection enumeration emits one representative per symmetry family; the HCP baseline guards against duplicate family emission and multiplicity overcounting.",
    "Bundled phase-fixture metadata tie the starter diffraction corpus to pinned crystallographic provenance.",
    "The current external-baseline surface is geometry-first and intentionally separates peak-position or shell-geometry agreement from stronger intensity-model claims.",
    "The controlling execution environment for these external-baseline cases is the full scientific lane."
  ]
}
