{
  "schema_id": "pytex.validation_manifest",
  "schema_version": "1.0.0",
  "pytex_version": "0.1.0.dev0",
  "created_at": "2026-03-30T00:00:00Z",
  "campaign_name": "texture_xrdml_import_validation",
  "subsystem": "texture",
  "baseline_kind": "open_source_vendor_xml",
  "status": "implemented",
  "reference_ids": [
    "MTEX_loadPoleFigure_xrdml",
    "xrayutilities_polefig_Ge113",
    "MTEX_ExAlODFReconstruction_background_defocusing"
  ],
  "fixture_ids": [
    "fixtures/xrdml/synthetic_random_standard.xrdml"
  ],
  "artifact_paths": [
    "docs/testing/mtex_parity_matrix.md",
    "docs/site/workflows/xrdml_texture_import.md",
    "benchmarks/texture/xrdml_import_benchmark_manifest.json",
    "fixtures/xrdml/README.md",
    "fixtures/xrdml/polefig_Ge113_xrayutilities.xrdml.bz2",
    "fixtures/xrdml/synthetic_random_standard.xrdml",
    "tests/unit/test_xrdml_texture.py",
    "tests/unit/test_defocus_calibration.py"
  ],
  "linked_benchmark_ids": [
    "texture_xrdml_import_and_inversion"
  ],
  "notes": [
    "The implemented validation surface covers PANalytical-style XRDML import, compressed-file handling, explicit intensity-normalization policy, and deterministic handoff into PyTex ODF inversion.",
    "PyTex currently validates geometric and import semantics, not full harmonic MTEX-class ODF reconstruction parity.",
    "Random-standard correction follows the MTEX background-first order and has an exact labelled synthetic reference; no claim is made that the synthetic loss curve represents a particular instrument."
  ]
}
